score,content
2,really updating needs like gigabyte phone download left second update gigabyte hoyoverse truly scammers
2,i change saved data server like want change saved game asia server playstation auto america server friends asia server cannot join them
2,the story good keeps crashing every second gets disconnected crutial moments gaming experience terrible issue
2,great exploration great combat one major complaint Ã­s insist forcing lengthy cutscenes despite pick play mobile game refuse add skip cutscene button infuriating respect time whatsoever minute play time play essentially minute playtime ten minute unskippable cutscenes long game clear care all
2,still controller support android pass point excuse shady deal play apple
2,love lot grinding ed take much look nice lol ok though phone little older side edit wanted play delete many apps files able dl sure imma keep long since kills battery heats too
2,may fix app please reporting cannot play saying storage already deleted everything still popping screen please fix app would give zero star cannot fix please thank id enjoy game fix tomorrow today please really want play think cool game love guys
2,i saw add game looks fun like exploring instal game takes much time downloading reason gave two stars please fix problem
2,could register using email address really forcing use either google facebook twitter register facebook twitter account definitely going use google account register issue fixed two stars game period
2,i india new delhi ping always high like playing game start seeing problem related ping months ping became game delay thought internet connection connection problems working perfectly app games please fix problem asap hard abyss it
2,i know happened update game got stuck update screen keep asking download megabyte data again really fix cost case storage still got quite lot know issue phone please fix developers
2,the game used gigabytes phone friends tell gigabytes however tried continue downloading resources says insufficient storage nine gigabytes left phone confused says insufficient fix bug please
2,this game amazing new update completly crashed game cannot past loading sceen boits laptop tried everything still nothing please fix getting annoying basically play anymore
2,the game perfect really sad really sad cos played game like hour day collect premogems type money game completing mission problem hard work character fails time spin like times favorite character wanderer failed lost premogems please decrese amount like half something money buy premogems please request heart please
2,we need buy primo fates mora barely anything game cooperative ritou escape plan quest lost motivation patience genshin cannot go serinitea pot unless quest emailed nothing changed stressed breakdowns please least give cooperative serinitea pot back game one ways destress working
2,the lack exploration tools aside character certain niche exploration lot time consuming certain event least modes much less rewarding compared difficulty seems properly addressed developers challenges seem like punch face dollar last story telling quality seems rushed especially dendro archon quest much less lore excessive explanations
2,the open world experience notable mobile game exploration fun rewards often given careful searching genshin best early mid game late game seems mostly grinding instances ideal equipment stats challenge content instance rewards limited time based currency challenge content rewards premium currency often requires premium teams earn full amount probably better pc console
2,very cheap rewards primo including resources year anniversary game event rewards given primo counts anniversary reward
2,nah matter fact fu game honest bad comes luck like losing winning em getting single good artifact spending resins like freakin resins man lot enough build like least character game enough build one character decently like ok spending resins take like hour daily limit damn man meh build you
2,little content reason build pull new character hope every region challenge like honkai star rails forgotten hall like luofu
2,extremely addictive fun start playing everything boring repetitive extremely difficult build character learn stuff survive game kind money buy primo five star weapons order good damage mention archon quests literal torture tapping screen pointless dialogue honestly began hating game
2,this game good but dying achse new update talking long time still please something can
2,this game puzzle stupid expecially archon quest puzzle world quest hate give clue
2,my dude please game playable much resource download devices compatible game fix please saw cousin play back thought fun resource downloading much play game mind fixing others
2,a fun pretty good game takes way much space phone app takes gigabyte phone takes whole lot space gonna blame game cannot think anything else recent update added sumeru game crashing much set graphic lower allowed play maybe minute started crashing almost every ten minute again
2,a really good game really enjoy genshin lot easy free play avoid microtransactions bit luck grinding event give currency use buy wish free spending money required fun late game however strongly recommend using pc playstation instead mobile incredibly frustrating play demanding device controls best possible avoid playing mobile
2,it fun start keep progressing gradually less less late game player limited ways primo buying addition since little new quests minute content every day resin system discourage since limited number domains started drops game easily improved
2,played pc verdict awesome sound dialogues anime esque artstyle everything awesome challenges pretty varied like various character large emphasis laid combining different elements fire electro cryo etc ps camera better pc android mobile camera work bad camera keeps changing rotating along zooming character whenever wants becomes terribly annoying especially fighting enemies two star
2,many thing game great examples graphic gameplay lore biggest issue representation character within certain regions feel like designed way supposed get another large issue active player past level adventure rank beyond much content left someone likes complete event
2,a pretty solid game understand hype one problem bugs low end devices horrible really mind terrain glitching character loading well stuck mondstadt archon quest confront dvalin his lair annoying glitch model dvalin look like geometrical mush colors cover entire screen adventure rank something reached liyue cannot progress story quest
2,the art style music world building game phenomenal combat fun little restrictive due little resources given game however truly dimin wish joy game poorly players feedback heard acknowledged growing list qol changes bugs continue left unattended along recent spate poorly designed character kit driven away thing change
2,seemingly good game fact controller support android many years tells want people play game exists pc ios understanding menu select input type whatever reason refuse add game size far bloated something play touchscreen worth keeping
2,it fun enjoyable game first maybe week playing completely run thing world real repeatable content locked behind resin system basically stamina mobile games max resin everything costs resin per run game quickly turns one log spend resin minute log genshin lot potential hope fixed
2,great exploration breath wild like systems better combat imo becomes lot less fun stop exploring quests start getting endgame territory dungeon times row fun especially since dungeons essentially fighting arenas know beat becomes tedious anniversary rewards suck
2,it deserves five stars first levels every system event build absolute garbage hard play daily basis game feels like feel like want lost starts limit every single thing want like flying noticing suddenly cannot anymore dissapointing
2,i sorry change review two reasons excluding anniversary rewards monotonous gameplay game really amazing comes story etc gets boring especially higher levels daily commissions bosses kill nothing unless time world feels like stuck loop taking player base lightly related anniversary rewards players disappointed conclusion given inazuma archon quest response players complaining anniversary rewards response ever
2,the combat fast fluid handles multiple enemies better witcher three dark souls character simply attacks nearest enemy free move around battlefield graphic gorgeous freedom exploration many thing find many little puzzle challenges dotted around game masterpiece free however couple weeks content explore farming remains
2,on surface five star game cost sixty dollars upfront due expansive world excellent gameplay tight controls intuitive combat reminiscent xenoblade however story world far complete attempting reach post story progress goals lead exponentially longer grind spread days weeks energy system cannot completely expedited hundreds dollars
2,it necessary admit core game rather good overhype lot exploration fun intuitive gameplay however endgame simply bland constant grind quick realise little challenge game character pretty much identical couple ss tier five stars necessary invest character anymore pc body types two males three fm app prices horrendous story dumb
2,it great game interesting story graphic sound decent pretty much everything free play user like said way updates trickle lack endgame lacking done available recent anniversary event overall way community treated developers worth giving a
2,it slow matter many storage good internet connection wrong good game keeps crashing environment models looses texture half time sure last time crashed whole tablet kept turning power try work thankfully alright now
2,recently getting black screen load game phone
2,too much grind unlike gacha games still controller support
2,it always stuck checking update upgrade version damn
2,add controller support backbone controller
2,my dude please game playable much resource download devices compatible game fix please saw cousin play back thought fun resource downloading much play game mind fixing others
2,the game awesome hate fact cannot see damage text please fix this
2,when first got game put stuff took hour load gave star
2,the game restarted beginning please fix it
2,please hoyo begging lower rng system artifact time consuming frustrating farm
2,the external game download genshin windows slow please fix it
2,the game needs eight gigabyte android never able play it
2,it system user interface keeps crashing want know whats happening
2,it hurts much playing game months single five star literally friend played week ago got five star mona draw earlier course got collie already literally saved forty sixsix primogens five days please better give reason delete game
2,hello hoyoverse updated genshin impact let use email keeps saying login failed
2,i honestly love game today why everything sensored damage crit long cannot say word without messed sensored please fix turning roblox worse
2,i waited sixhrs cannot play game router perfectly fine problems good connection uninstall install repeatedly cannot enter game says error forty yet games require internet connection problem genshin sounds like want play game truly unfortunate enjoyed shame making game experience worse star bad review asia server
2,this game clearly lot heart put interesting plot interesting character main story quest bore hour hour unskippable dialogue seem amount thing little actual gameplay comparison sometimes forced character quests addition way dialogue necessary skip button skip entire scenes maybe bit better
2,i playing since release gameplay keeps playing enjoy hour hour dialogue go story quests please give skip button never played game skip option cutscenes requested multiple times survey feedback nothing gets done everything else great gets annoying want play quests without dialogue cutscene interruptions
2,the story lines interesting character design fantastic therere many places explore event okay sceneries absolutely breathtaking overall game fine definitely recommend play problems game took way many storage space really lag screen sometimes freeze really annoying please fix it
2,at best one best mobile game experiences terms depth map incredibly big graphic quite mind blowing first problems with predatory monetization long winded unskippable dialogues abysmal performance especially android devices flagship devices samsung galaxy ultra lowering settings optimizing device much game unplayable couple minute
2,lack diversity playing game almost years daily good overall experience thing offer however issue start become obvious new releases lacks diversity skin tones body shapes weapon styles very lacking community saying almost years yet response ignored flagged aside issues problematic bad designing
2,music awesome graphical style design lovely however gameplay mostly interesting quite often rich repeating actions over monetization model great quite awful kind style games like map still development optimization became worse since two point zero update cannot recommend genshin ready pay lot money fun play aint willing grind
2,the game good potential great nearly years playing next nothing changed still got old boring routine count artifact farming dailies endgame besides abyss event always temporary never permanent problem event example hide seek one great permanent feature game edit wanna say enough space left
2,great game play pc time android version extreme oversight though absolutely controller support drop change touchscreen something else nothing shows honestly pretty disappointed touchscreen controls really bad update ever change sticking pc
2,i seeing change whatsoever year half games release sadly resin lock artifact hard farm frustrating random hard level character want well maybe bit generous gave fragile resin quests event hell abyss reward experience better shame world building nice
2,finally playing playstation game needs contrast phone little easier see stuff playstation physically closer screen colors sadly blend together quite hard tell whats looks super nice hard see details far great game needs color adjustment update storyline sense
2,this game use favorite loved everything game graphic challenges art especially free adventure roaming time world level goes game gets harder give enough boss drops next accession rank end getting hit damage needed loved new island arrived art culture amazing dony access power ups level low miss stuff
2,i played game pretty solidly paid several monthly subscriptions battle passes thing absolutely broke artifact problem grind problem time sink thing feel quite d eartening working several months goal improving single character artifact feeling like zero progress made long
2,good quality story progressing awfully slowly game nothing time everything buyable expensive rewards game tasks small becomes work fun games supposed still play pretty graphic animations familiar voice actors know long last unless significant changes made
2,very poorly optimized phone immediately heats loading heavy apps barely stay less five minute black screen kicked game loading times incredibly long spent time loading screens actually playing shame looks really good regarding world building art character design may try installing later date maybe works then
2,the game graphic combat system great however adventure rank requirements next missions annoying obtaining primo getting good character takes much time lot people drop rates heroes extremely low spent fifty got absolutely nothing good return play game least week least five minute
2,can barely condense resin game constantly freezing crashing etc lowest graphic settings newest phone date problems games app preview account condense resin use later time pc instead log app anything inevitably crash within minute
2,honestly one best rpg mobile games found live story character animation give higher rating fact game keeps crashing got level six run fight normal enemies start freeze crash tried cleaning phone cache made space game uninstalled installed continues crash gave finally uninstalled completely
2,it gorgeous game amazing graphic engaging character beautiful storyline glitching sound cutscenes whenever character speaks game unplayable unpleasant sure causes issue ruins game hope support team contact sure issue phone game
2,the game really gorgeous good exploration fun features however awful highly unstable performance along constant disconnections impossible enjoy november update stability performance momentarily better less catastrophic e gigabyte reconnections short less frequent situation quickly decays indicating perhaps memory leak please continue build progress made fixing disconnections
2,game looks lovely controls need work passed tutorial much difficulty getting used controls tried searching options way invert screen controls realized genshin impacts devs thought wait hope rudimentary option gets included next update
2,graphic pretty neat rate low inverted controls play games x axis inverted difficult train brain play way around please developers add option invert y x axis five stars option remains almost unplayable me
2,the gameplay great controls need reworked implementing idle combat interface good idea stealth kills good idea crouch button well evasion button good idea implement options change interface personal liking whenever turn camera able accidentally press hold attack button another thing camera moving combat headaches weird angles has
2,the game great graphic story frustrating play without controller currently supported android reason fighting exploring world rate app much higher plays much much better playstation controller pc mouse keyboard
2,well gonna give game good review good graphic love open world good music everytime launch app begin game freeze loading screen waiting helping re downloading fix problem tried options usually help guess nice lasted whole day really disappointment thanks wasting six hour life
2,this game incredible terms open world exploration combat gameplay straight dysfunctional however good game combat cannot mobile terrible gameplay pc complex console straight destroys fingers amount money someone needs spend game single character terrible game overrated cash grab pulls players using overrated character people simp for
2,the files large actually play anymore fun game play cannot unless delete everything please fix people actually play want able play actually nice time well apps besides game really fun colorful definitely give better rating file thing fixed thanks reading
2,hope requires little less storage required almost gigabyte android phone remove audio package old quest file hope optimize game little good graphic story storage issue
2,when downloaded megabyte open start play take megabyte oh god downloaded it
2,a great game core respect time absurd lengths wait certain character weapons rerun justifiable reasons behind qol improvements scarce massive list community complaints requests never likely never addressed longer invest game realize multitude problems easily take precedent resolved simply not
2,i login account via facebook fix bug want loose acc
2,the game great problems logging like try least minute world playing glitching kicks game reaslly annoying cannot play minute day please lemme know fix it
2,how connect xbox wireless controller
2,it really fun game spent three hour exploration new four two region one upgraded fontaines statue max level current version event quests got eight pulls freaking eight pulls cheap please everyone tired endless grinding farming lose s
2,i wasted lot money game used play seven old phone ended breaking got new one enough storage app leave comfort game character worked hard behind hope mihoyo fix game takes entire phone computer cannot play guys losing players fact game halfway complete already megabyte problem
2,reason way two star rating game really good reminds zelda game starts skip freeze lot maintenance days game keeps kicking update messed gameplay pc phone longer plays smoothly freeze every ten minute kicks hope fix really like game
2,amazing game still cannot believe free play one best games play right using mid range high end mobile device edit uninstalling nov four two patch dropped fun game long while
2,boring minim konten end game gampang di hack gampang dibobol cheat dev kikir padahal revenue gede tapi ngasih hadiah anniversary gak ada wah wah nya sama sekali please separate tcg main game tcg useless use benefits primo like spiral abyss
2,constant content drought bad artifact systems game fairly boring
2,in beginning interesting reached level story becomes poor recommend download game
2,i excited play game downloaded said take gigabyte space mind gigabyte left taking hour hour load close playing said something went wrong brought back start mad wanted throw phone across room patient loading thing thing happened please smth played frns phone fun thank u
2,nice game livestream code shot time redeem long enough hour least hour many game giveaway seem intent giving this
2,this game sickness worse covid suck away time ifyou prevy money found trying justify investment onto game trying indoctrinat friends telling good particular character knowing well wanted spend well made game ever increasing goal getting hooked game feeling grateful legit mind control
2,they add space resins reach adventure rank enough
2,i want log second account writes many requests please try later want play second account please answer bought sec account money using leaf
2,uh really liked game fun love big world unfortunately recently uninstalled pure annoyance takes lot space trying to quest freeze phone completely need restart sucks genshin takes long load
2,once become stronger sucks game expected fun cooperative sucks
2,i really love game cannot load without crashing
2,make story dialogue skippable five stars way long way draggy
2,why guys favor honkai star rail hi guys literally included features begging include genshin year honkai star rail blatant guys probably use revenue improve two baffling little care game refuse hire good devs like two love game really painful ignore community
2,if want put two five star weapons one banner choice gacha still gives five star weapon choose better throw away choice setting thank you
2,im able log account logged hoyoverse keep saying invalid account format anyone resolve issue
2,the amount time takes complete story compared old chapters baffling rewards good like primo five hour gameplay playing game feels like chore ever game targeted casual players think anyone want go prison act fontaine again
2,game really cool never controller preferred work game checked forms tried everything games use work fine ever figure update wanna use touch screen play really issue
2,the download resource took forever loading screen beautiful
2,it let play keeps saying storage thing videos games gone
2,with new updates able play game takes much storage enough storagei able play much glitch
2,takes forever load loading screen looked awesome though
2,everything lowkey lag crashing times fontaine update thing pissed long hurtful update internet using internet connection decided restart whole progress downloading guessi playing anymore
2,game loading past intro screen keeps shutting please fix soon
2,im dropping game five stars three stars artifact grinding takes much time grind artifact end absolutely terrible ones good terrible rolls end becoming bad resin cap increased enough amount farmable content available newer players harder level character locations opened up
2,honestly like game taiwanese player ruined game really manner klee main always think klee junk think dumb player everytime something spot like doctor observation mental patient f beside lot taiwanese hate game play genshin try cyberbully facebook
2,the game cool fun see lot hardwork developing game comes gacha pity system bad playing game nearly two years honest never got soft pity winning ratio lower losing lost nearly seven times won three times feel gacha system removed set guaranteed pulls players save favorite player all
2,the game constantly updating amazing cool new features everything much bigger gonna barely fit able something updates gigantic file size
2,quitted year ago gotta rate one last time graphic great mechanic though two skills game end game content besides abyss literally hell average players feels like job average rewards hoyoverse intended feel drained overall still recommend people time hands willing grind endless hour casual players lot money
2,whenever launching game needs download resources always takes forever
2,the new update keeps crashing every time try play game device
2,it took forever load uninstalled think ever load
2,i able play briefly deleted nearly every app removed samsung room waiting three hour downloaded via internet connection next day told needed free space started another marathon download bollocks game uninstalled
2,good game bad event worst greedy company tried silent community actual end game fiture three years still endgame content
2,after three years issue vertical camera movement freaking slow still fixed devs seem care like want players look f climbing flying monsters first place game made pc used play ps awful takes five freaking seconds look slow mobile least swipe x super fast look cannot controller
2,i starting lose interest playing always spending lot time gathering primo gem hero feel like wasting time
2,the continously large updates playing game hassle every month size updates larger larger gigabyte gigabyte gigabyte draw line somewhere cannot stand anymore
