score,content
3,i love game issue resin limits enjoyment really skip option story dialogues though story understand know character taping like maniac finish asap continue playing cause thing arrive super tired energy endure skip let enjoy read later game archieves cause really appreciate though every stor
3,lovely game amazing graphic great story line many flaws first much representation game character snow white every character thin second players many rewards third game gets boring quickly adventure rank achieved every quest every event much game less fun personally love world quests thank you
3,i like game lot quite problems gacha system expensive hard collect primo every day couple wish without buying levelling adventure ranks difficult well many thing day collect experience amount gives really low third final problem big game delete many thing able download game
3,since device lot capacity might eventually stop playing game playing nearly year regarding issuei hoping genshin team scale games overall size takes lot room computers cannot begin imagine much space take regions added
3,uh kinda boring stunning game little endgame content pity system extremely unfair annoying game creators barely representation black cultures character design problems game solid rpg mmo game fun gameplay lot character cool character animations lore game deep explained yet grindy game play every days
3,been playing since first released felt like much however genshin impact added sustainable content since release except new domains bosses requiring resin first three rest resin resin capped per day one takes eight minute regenerate resin back takes minute major issue players willing commit game played long time
3,the game good story world character keep coming back play regularly pc turns kind need relatively new phone play mobile version granted phone super old mobile version unstable gamble past title screen feels like good looking game mobile fact graphically intensive keeps playable mobile
3,the dialogue bit slow cut scenes cannot skipped game fun bit tedious grinding mats wish character weapon summons best part able carry account platform platform update like add game needs fast forward option dialogue skip feature cut scenes better camera management combat constantly sinking dirt character knocked slightedof breezes
3,still good game though use mobile purchases primarily play pc game time gate much expanded ability play users pace regardless fast slow like go content understand game still development may feasible time hope consider increasing resin improving drop rates attribute rates artifact updating standard banner game matures
3,played year problem commissions repetitive game event really desirable time eventually boredi rating three stars since game needs significant improvements terms thing mentioned forcing players play commissions welkin moon kind annoying convenient feature welkin moon charges log in
3,this game great played months id say recommend graphic beautiful tons interesting character story interesting freely explore open world parts tedious sometimes game crashes goes slow played many different devices keeps happening missions need level next one sometimes tedious hing
3,have playing game week everything seems perfect fun except monstrous size app data consumes update efficient players configure additional file download per choice like pubg apex ledgen like league ledgens
3,it for starters understand appeal generic anime art thought worth try since popular enjoy strange character switching mechanic already see buying character seem necessary many players whilei fine games micro transactions think fluff rather buy game outright ran smoothly tablet sheer size map impressive
3,this game great play long ago great captivating graphic lore interesting new update made game unplayable phone graphic quite bad frame rate constantly freezing crashing cannot move two steps without game shutting great game ifyou phone handle new data update
3,great game battle mechanic graphic really smooth quite lot learn beginning may quite confusing downside side rng mechanic game five edit patch two four texts mobile banner updates extremely zoomed inconvenient navigating surveys history difficult annoying game currency given player low compared slow paced game without much do
3,i love game pop time time hopped long play laptop well phone computer use account tried mobile acting likei new player asking pick twin please fix account restarts think call know weird account data suddenly gone
3,long process follow game made phones file quite large story every traveler experiences long journey complete game larger map wander cooperative wide open friends viewers streamers interact system slowly surely likable new players possible difficult weapon banner players struggle with
3,really enjoy game two issues one ios wireless controller support android absurd please fix two process pairing save file devices console android example specific sequence needs followed otherwise beg customer support unlink one device takes potentially week half sequence explained clearly except forums go gotten wrong
3,pros one beautifully crafted world rich story lovable character two combat fun exploration enough keep one adventuring three tell developers put much love game marketing division mess leads cons one certain systems time gating remain broken since launch two rng top rng three predatory monetization four much focus money enough fixing content all solid
3,great game ifyou experience argue best one however stay long gonna deal variety problems devs fixing simple mistakes years joke blantly ignoring community unhappy probably significant issue game allow play whenever want play afteryou done quests instead becomes second job
3,okay mobile game awful story writing lot unecessary dialogue character well designed mostly balanced years old glitch left unfixed continue pile new character e gigabyte dionas skill burst still hit objects instead enemies closer objects settings mess obviously pay win
3,it good game free play friendly installed long time left has troublesome problem downloading resources suddely internet connection become sucks quit halfway current progress loss start beginning download game cannot detect game file waste time
3,its great playing since launch basically fun time sure cannot say perfect newer players difficult level certain character due materials locked reach certain levels clear certain areas think recommend casual player someone whos going marathon game like week much problem
3,i say game exceptional one terms lore quality beauty going adventure experiencing fantasy however friendly new players lot new player must overcome order truly experience lot veteran players new player lock definitely driving enjoy game away especially bound start mobile players needs fixed resin system
3,definitely good game play lot pc downloaded chromebook google play said compactible sadly graphic set high default mobile always crashes every time enter door reach loading screen game really needs settings option outside game default graphic values lower please change
3,im giving three actual game good mobile version pain hyakunin ikki event one example takes many tries enough points first rewards reason cannot defeat enemies enemies take actual minute spawn time trials mobile version issue objectives spawn ten seconds lag cutscenes quests unbearable actualty care story
3,fun first however much explained well new players leaving people find trial error open map puzzle hardly hints rewards puzzle entire game matter lackluster gear character take months depending luck gameplay visual nice take much space overall rng based gameplay anything actually need play
3,i love game fun game play good map problem takes much space like game takes storage download every good part gameplay seriously cannot one app really hate part genshin although takes much space fun game possible please lower amount space genshin impact uses run smoothly able talk friends thank you
3,it great game overall good graphic nice gameplay really inmersive story beautiful character tailored everyone finds favorite games big flaw mechanic swear comes farming thing hard artifact indispensable actually using character like boring tedious aquire probably end dropping game farm think hoyoverse
3,great point played phone playstation although point stuck unless lot friends play one area cannot complete without full team players needs guilds complete friends interested type game otherwise stuck cannot progress ending work completed huge downfall game multiple friends play cool go it
3,first game good good graphic good music good story lag consume battery give option twick draw distance load metres away mountain game lag time camera far far away character near character immersed gameplay camera zoom helping times camera comes normal position
3,i recommended game lot friends work well android every time gets wearing headphones may improve gaming experience part game usally crashes closes loading takes way long well dowloading
3,i updated second loading screen finish give reconnecting server go loading screen fine like times keeps repeating like times already line fine try next day still like keeps repeating like properly log like getting annoying
3,its great game visual along playable computer well phone account enabling crossplay great let worth two stars lack controller support add update until play computer
3,has quite issues bugs character never fixed ridiculously high prices game currency justifiable point poor storylines complete ignorance comes complaints international players list go on extreme high usage storage space however still amazing game stunning sceneries graphic character event enjoy game anything else hope changes future
3,the downloading resources repeating back zero waited several hour download gigabyte paused decided continue later back start repeating download gigabyte resources reset clear anything storage game filling phone storage repeat two times work back start again
3,i play pc game refuses load phone game overall amazing one best elemental systems ever seen lag pc takes huge amount space large mobile game despite uninstalled reinstalled changed phones used internet connection ect never goes past loading screen favorite game see playing mobile viable considering sheer size game
3,the game really good aspects character design storyline battle mechanic thing bugs resin ifyou trying build good character want go domains cannot anything upgrade anything ifyou resin increase amount resin permanently reduce time resin accumulates
3,i playing absolutely love game however two four update noticed everytime use elemental burst five star character number enemies group enemies bosses hp bar disappears including use names npcs disappear disrupting gameplay draining time consuming restart game everytime use character burst hope fixed thanks
3,i usually play laptop liked much wanted play mobile device removed several apps pictures videos still able download amount space game takes mobile unreal point litterally unrealistic takes one four one three phones total storage however pc wonderful game storage capacity encourage try graphic fighting mechanic wonderful
3,updates suck android done pre downloads new versions always mess getting completely uninstall reinstall game sometimes like work soi writing since cannot game love game general getting resources new character extremely time consuming considering give five primo majority quests ps easier far gameplay updates
3,i like giving three star one best advanced games store right justifies space takes game already big lot unnecessary stuff takes space event cinematics etc option download remove unnecessary stuff game adjusted better mobile best phones turns demo hell minute playing this
3,its awesome give five star problems game play everytime play course log problem know many minute play everytime smth like fighting enemies game starts lag screen turns back kicks cooperative happens progress restarted hope gets fixed really wanna play genshin go
3,gacha impact game collect scannotily clad mostly age women dudes fight monsters game great gameplay responsive flashy game falls apart pretty quick pay time pay money stupid inconveniences go away progression really important games game wants monetize encourage spend much money possible games much better this
3,i really love game fun gameplays event offer however love recommend play game problems whenever play short amount time game ends lag completely crashes app phone well wait minute screen character last played attacks skills still time freeze happened many times andi worried future players
3,played beginning left wanted back anniversary really dropped ball anniversary weak ten pull game fairly unreasonable pay structure rewards lack resin always huge problem game well received initally high hopes bad positive changes improve enjoyment players overall
3,would love game optimized better takes quite lot space heats phone eats battery lags heavily slightly older phones friend unfortunately drop game altogether due increasing size andi worried many including affected well all great game love open worldness gorgeous atmosphere alongside wonderful music storyline engaging promising character boot
3,had change review though game made well filled wonderful character story game slowed crawl content slow coming event lackluster boring event fantastic simply game available everyone anytime sad event never return resulting new players missing fantastic lore provided
3,it favourite game dedicated flaw game bugs hell wangshu quest disables co operative mode completion many quest operating properly sweep rug impossible due fact need co operative mode game enjoyable
3,this game lot issues hard excuse parts fun fun take lot time issues touch seems like character struggling need help inconsistent mechanic seemed randomly apply one character lot dead time pull weapon banner unless intend spend lot money rewards completing quests seem really lackluster
3,tl dr prepared disappointed ifyou gacha player likes grind play lot general enjoyable many problems appeae form of end content energy timegated system artifact progress better gear story enjoyable expect something well written lot character problems event rewards okay boring play replayable content side quests become tiresome gacha insane
3,after playing one year genshin impact amazing game surface level great world building character design combat system story graphic however going deeper game many glaring issues addressed lack endgame content high effort low rewards qol changes resin system artifact rng overpriced gacha recent downgrading story character game becomes increasingly disappointing daily chore end
3,edit one greatest open world animethetic action rpgs time world character design amazing joy explore listening enchanting orchestral osts combat grinding gets abit boring due endgame latest character need extreme balancing new players sol spend hour main story extra weeks grinding adventure rank able upgrade mats adventure rank region locked system sense
3,i new game far enjoy playing suggestion must bar adventurers leveling ranks god hard ascension task level though heroes higher level right element combat electro hypostasis still heroes underpowered tiring play deal over consider hero replacements deployed heroes haha
3,it great game greater controller support another issue mobile version sometimes objects takes long time load interact button sometimes late resin refresh rate feels like forever cost one much odds winning four five star character
3,the game good early major problems gacha enjoyments sake free play friendly small subscription option welkin bp low spenders good personal opinion well however resin major problem game specially end game character pull weapons frustrating fight couple bosses couple domains random drops amount upgrade andyou done day point daily login app game
3,a beautiful game many amazing character places visit powerful weapons however sometimes lack communication basic rewards fans frustrating especially adventure rank rewards amount resin needs adjusted well artifact rng need reasons play minute later game thing end logging commissions burning resin logging often feels like chore
3,i enjoy game rng gacha system basically everything really pulls back stats gear way change continue griding pray cooperative thing nice balancing character best controller support android year really sucks said pretty nice music story good to
3,honest review game beautiful honestly seen mobile games come close terms graphic music score beginners game fine progress realize multiple issues games resin needs adjustments higher ups listen community terms issues free play pulling character especially one want difficult expensive especially decide saving primo not
3,it gets repetitive dialogues way long every new character unusable unless able upgrade level character upgrades takes lot time android version support controller optimal
3,good game resin system needs rework fine game first came due limited amount character seeing double amount character farm resin regeneration cap needs much higher game quite lacking end game content spiral abyss dps check moment kind boss raid cooperative content much appreciated
3,awesome game beautiful art style huge open world map incredible ost really nice character keeps accumulating bugs never fixed addressed history writing recently got real rushed bad character comes half baked gameplay relevance history almost non existent side character way relevance impact playable ones additionally lack proper communication throw mayor positive aspects game unfortunately
3,the gameplay world music fantastic lack communication community interactivity lately abysmal seen gacha game started strong aspects deteriorated alarming rate mind lack rewards anniversary fanfare communication transparency acknowledge problems instead trying sweep rug say going fixed
3,while game bad become boring less stuff lot re works many character needs done like address underwhelming reward anniversary everything web event less game content rewards
3,you great map expansions puzzle fun finding secret hidden chest fun hidden quest fun exploring map maxed character boring one hit per kill please add high risk zones maxed character feel still need healers exploring map
3,the beginning experience fun endgame content becomes dry nothing meaningful outside waiting energy time devs started careless stopped acknowledging player feedback much ignored multiple bugs character long time anniversary essentially ignored player base entirely sad see aside character pretty cool
3,great game still room improvement please raise resin condense resin five ten cost halving opportunities weekly bosses artifact sets hard complete please implement rotation pieces game visual soundtrack ten ten go stage filler patches need resin system improve play risk game greedy management
3,it really fun game however endgame content felt like chores everyday adventure fun challenge besides spiral abyss relatively easy still rewards cheap gacha still requires put much money effort getting pity guarantee five star want sometimes soundtrack graphic amazing happened past weeks really bad
3,a fun blend action rpg adventure game rather impressive visual soothing soundtrack solid stories fun character game stuck tedious boring sometimes frustrating endgame ends massive grindfest highly predatory gacha system five highest rarity units limited event specific banners company mad stingy anniversary rewards
3,used really good game recent quests feel rushed plot anti climatic starting feel superbly unfriendly free play players rewards disappointing nothing much daily farming rarely gives anything good lore game feels stale though created good setting inazuma promotional posters built suspense useless end quest
3,developer listen feedback despite putting survey every major update several character completely worthless suffer bugs remain unfixed six months release resin system heavily limits gameplay almost everything relies upon rate higher simply addressed issues since base gameplay actually good
3,very good game easy hook small issues always feedbacked seem like fix anytime soon music gameplay great story character mechanic system good first become unbalanced go slightly downhill maybe rushing low quality control game great still lot drawback recommended gacha veteran lover
3,been playing year say resin system needs improvement hard farm artifact materials resin per day well rewards somewhat stingy enough wish pay real money wanted character weapon great storyline graphic really like open world game really limit something finally mobile
3,initially game awesome hands best ever played wrt graphic scenery character story disappointment rewards lack consideration towards player base story world building hands best pace updates roll slow frequent amount time actually takes story move long tires many people like minimal spender miss day feel like lost something precious building want rewards hecki fine already please put lore give character like lisa kaeya amber love like character colorful numbers pop screen oh ludi harpastum supposed right
3,the game great beautiful scenery music story great character amazing unique enjoyable progress lack sort end game content except spiral abyss please instead making floor worse add floors add something new please communicate players listen want lovely experience want better thanks
3,the graphic beautiful world fun explore character design amazing music nice fun game general needs lot effort stuff give low rewards like first anniversary give free stuff promotions give free four star event sth better ten wish one whole year playing enough least fix bugs improve aspects
3,edited first review might emotional love games gameplay music non event activities pass time eg music hangout sims house hide seek event come least twice week though cannot still say much games anniversary games lore interesting though latest chapter bit lacking sense posts still implemented distributed eg wings event fast food chain switch version game
3,visually stunning game amazing soundtracks however aspects game namely domains relies heavily rng quite frustrating current pace main story progresses slow resin system whilst normal feature gacha games severely limiting genshin use days worth resins less ten minute greatest downside game way company handles rewards compensations lackluster
3,i playing since launch faithfully played hit burnout wall couple months archipelago update spent way like think game andi terribly proud ultimately decent good game great art amazing visual fun greediness gacha rates resin system artifact rng sucking life player base add lack endgame content lack rewards disaster
3,i mean skeleton game good solid gameplay good story exploration really bad systems like resin gacha general artifact game way less fun play additionally rewards game best say least
3,late game company stingy voice acting good quality every language runs okay galaxy better pc albeit locked fps character cool cutscenes extravagant graphic amazing exploration blast grinding fun shame greed lack rewards
3,repetitive finish current story updates inbetween updates farm primo save new character story character great somehow breeze time consuming non important daily commissions updates easier way keep track wish like counter something banner pages easily see guaranteed five star
3,i really give game five star rating open world phenomenal fun explore someone late gamei trying entertain photo taking beautiful scenery etc however ever since two update thing really gone downhill english stream two one update delayed one half hour character released despite seemingly unfin ed kit anniversary rewards mihoyo listen fans
3,overall game already good mechanic sucks please consider removing decreasing amount resin needed artifact since one highest resin consumer game artifact system based purely luck artifact needed good stats sub stats please consider changing daily commission rewards differ based difficulty ten easy hard commisions may randomized fixed rewarding
3,genshin impact great adventure without entry barrier exploration similar breath wild collecting climbing gliding however combat fluid dance b managing partys abilities chaining attacks character distinct unique personalities story filled beautiful cutscenes lore voice acting visually impressive game edit decreased score due low gacha rates freemium currency hit soft hard pity half year
3,i played game since release loved exploration beautiful world amazing character interesting lore afteryou done exploring finish quests nothing late game never ending grinding hell nothing left keep releasing character worth hundreds euro months grinding saving full problems address story sense anymore devs care shows
3,it really exciting first storylines character getting boring new event unique enjoyable reach certain adventure rank game becomes boring repetitive getting obvious games focus getting new players care old players
3,it almost one year since started playing rate three stars issue game device redmi note seven pro runs perfectly fine medium graphic however enter serenitea pot game freeze two second entering close game restart long process loading screens sometimes freeze try interact something within pot please fix problem reconsider rating
3,while game amazing game meant played mobile highly optimized still lot lag tabbing app cause relog game insanely long load time app used story dialogue character enhancement anything lag matter
