score,content
1,for whatever reason game used work fine except cutscenes crashed play use geforce refuses open opens shows black screen promptly crashes tried uninstalling reinstalling took three hour way restarting device work fun game though
1,i like game seriously thing need fix mostly either able skip dialogue pause stuff continuing archon quest current update minute without able stop need redo everything least warn people long stop course need fix everyone wants time go everything straight away
1,downloaded worked downloaded says insufficient space every single time though plenty space deleted apps removed pictures done everything try work delete redownload restart phone clear cache data clear cache data playstore everything disappointing hell cannot play
1,my data mbps open game ms speed normal daily run mission his ping turns red his ms every time meet enemy something like must happen fighting ms normal meet enemy ms lag time waste lot money feel like loss something like happens sorry english bad playing game since released really disappointing
1,i played game problems game done downloading try play says infuscent space stops starts loading never finish process please fix it
1,i used love game quite disappointed wishing system guarantee five star character aiming use wish one reason stopped playing game although graphic storyline great wishing system nah highly disappointed gonna play game anymore one star enough
1,resin per day atrocious idea fact certain character powercrept bad new region character complete constellationand constellation serve optional qol improvements yet hoyoverse greedy dollar character expected decent constellationand full potential locked constellation mention lack skip button gigabyte open world game lacks skip button guys amazing
1,the looks cool really like play state delete system files run device bulky files download sd card run fine games smallest files download sd card download internal storage
1,my phone stops working every time try play game normally happens often fontaine please fix matter never play game lost two account whether uninstall game re install work keep restarting phone work either highest graphic lowest
1,do bother playing mobile pc console game frustrating deleting bunch stuff try fit size requirements game fail everytime stick console pc mobile controls great anyways controller support great game otherwise mobile support abysmal
1,been trying update redownload game several times tried getting rid apps photos stuff yet keeps telling insufficient storage starts download log loved playing longer continue thanks whatever blocking playing
1,the game getting worst lot bugs bug still fix lonely place screen turn black crash cannot complete archon quest mission black screen try reopening game nothing showing screen another problem use kaeya freeze skill water ice showing water tried reporting bug feedback game still waiting update
1,stupid app know long waited download download update started reached gigabyte size keep hitting retry notification popped check connection downloading though internet connection fine stupid app retired today playing version enough it
1,gigabytes download file optimization shaders optimization took forever only stuck story skip choose either male female children character customization cause left stupid fairy go directly destination instead long way wanted go way back follow uninstalled it
1,from see main menu game looked decent cannot play game says insignificant storage deleted everything phone nothing playstore genshin photos either disappointed trying download play again
1,downloaded game last night went play work find download update five hour later update reason whatsoever mobile game take five hour plus played expecially newest model phone cell service internet connection played game already annoyed it
1,why anybody continue play thrown away every little twig gets thrown enemies still hitting like nothin happens skip dialogue glitch enemies lose shield glitch keep falling place pulls shop bad saying chance spend like one hundred fate thing gave one character over care actually no
1,i really love game deleted months ago lag downloaded took ten hour download everything let play everytime restarted game loading screen geo part almost done game automatically log out
1,i tried downloading app chromebook crashes whenever tries download shaders looked reviews hoyoverse says thing like talk game customer support cannot game customer support game crashes try download great game played ps bulky app collect dust pc probably never happen sucks hoyo buy primo downloaded
1,sigh two years playing game stunning graphic great story lore unique combat mechanic building many character stronger devastated hoyoverse statement give end game content give anxiety casual players stupid statement planned quit game hoyoverse want change plan patch end pretty finish building element character comeback hoyoverse hear us
1,a decent game way much dialogue cannot skipped missions seems employee game spend hour earn meaningless reward gets boring enemies quest story place although day one player option quit game draining rewarding
1,i downloaded game play store looked amazing however connecting facebook gmail kept saying insufficient storage available removed gigabyte phone uninstalled reinstalled still says thing phone samsung fe one terabyte storage maybe folks might need update send manual wrong update gets resolved uninstalling
1,since downloaded fontaine map keeps glitching shut apps reload game happened multiple times consecutively sick decided play game weeks start game problem still happening hoyoverse please fix legit cannot play game keeps shutting change rating fix issue thank you
1,when play game low graphic phone still heats freeze phone leave freezer minute cool takes storage really bad cannot change settings know phone freeze trash app thing good updates new character instead new charcters graphic look better wang ban dun bui zui
1,re downloaded year percent new content basically visual novel slow dialogue super boring completely overshadows gameplay mechanic come back option drastically decrease time wasted watching character talk other
1,the game gets much hard basically impossible casual gamers inazuma past one damn quest stuck difficulty slider pay win game lower world level one past world level currently level currently basically quit game aggravatingly difficult play
1,character design stories well made main overall plot non existent adventurer rank begins miserable abyss artifact gearing grind ruins game expensive gacha terrible rates chase gacha caution spend money game enjoy second anniversary event moving settings sliders devs never fix problems ex notifications still broken two years android controller support quitting game best
1,no controller support cannot remove screen buttons mobile exprience good pc version worst cannot customize controls either keep making game boring back long time lot explore event still boring ever need hire better game designers
1,it really good recommend lot people takes much storage cannot play five star better chance character animal character thank listening please takes much storage deleted every single app phone work
1,a number issues built time worst gameplay damage output issues new character especially dehya disappointed still resin cap regeneration increase despite many new bosses met radio silence devs still enjoying game star actually listen player feedback
1,i reach customer service said phone compatible install game bought phone year initially install game works well weeks game crash got error saying system user interface responding tried basic trouble shooting nothing works check google play store says compatibility works device reinstalled fater couple days carsh error
1,it years since release game yet controller support given android users showing favoritism devices eyesore storyline gets boring progress forced eat dialogues long dialogue contains important detail rest bull overall gacha system bearable game negative factors given game recommended dislike faulty controls
1,really great game recently spent dollars controller find controller support android like come funny graphic really great love story add controller support android put five stars tell friends play games right play games actually controller support devices cannot touch screen much reasons
1,this game enjoyable originally came subsequent updates however skip option alternatives tough keep storylines know work hard create plot lines genshin individuals simply time keep up
1,uninstalled cos rip want level real good pay money leveling character still good enough stories boring asf take long skip many mission plus side games cannot keep play enough rewards level certain level fight rewards level character
1,the game good artifact system super unfair farming domain certain character year gotten piece fits well character weapon banner huge scam reset everyime worst game super unfair unlucky need resin
1,it reason mobile action games controller support either developer lazyness ineptitude despite claiming app version basic functionality expected genre unplayable mobile update years still controller support basic functionality unity dropping one star
1,love game great free zelda botw clone unfortunately phone beefy enough run playing ps amazing edit years officially released android still controller support luckily redmagic six pro gaming phone special controller similar joycons remapping functions currently cannot find absolutely ridiculous complaints ignored star fixed
1,for reason sprint jump button cannot moved attack buttons keep jumping sprinting rather attacking sure buttons cannot moved interface sucks like developers want stop playing reason
1,rng fckng awful high demand low return hard pity artifact roll artifact drop substats three years qol requests fulfilled instead put game lmao love lore love character playing rewarding rng help feel shit feel like spending anymore cause feel rewarding besides aside free items codes feels like scraps lol new character shitty skillset
1,we need skip button lot people already sent complaint response need skip button want skip stories think people changed servers already know flow story archon quest choice click faster finish dialogue lmao
1,this game good storyline graphic everything updates cannot play phone every time try glitch close already set settings low cannot play anymore phone
1,still controller support three years iphone already cannot put android device already features brand skip features takes lot time finish dialogues gameplay takes shortly want to game bad simple features people wants want geez keymapper apps gives temp banned user still one star features four star good game
1,great game new concepts event upgrading constellation five star character well getting refining five star weapons mostly impossible free playplayer apart game primo available event really less quantity considering number wish five star character items resin refil slow cap really sucks
1,it great everything feels like chore long boring dialogues sumeru tcg absolutely nothing open world rpg unnecessary play else resources need edit everything great fontaine sumeru definitely left bad aftertaste going change rating that
1,very poor experience far first install game play store think ready start playing got download yet another package ones downloaded verify another package keeps going endlessly goddamn music app game bad ripped theme titanic music
1,the games fun leave problem lack proper gamepad support fix goddamn optimization thing almost brick three days brand new phone fill goddamn survey whatsapp massage got incompetent truly left rotten taste mouth otherwise stellar game review
1,if chromebook install really smooth sumeru update various glitch play female character crashes acts like walked map raining fight crashes sit sink map character details load faceless shadows one coloured clothes ect since fontaine hard enter game usually try around six times in
1,it trash cannot play controller game access fps supposed really good game well think bad keeps lag like crazy high end devices need fastest internet world barely stay ms worse fps controller mean supported ios gotten worse fix game mihoyo trash mean favouritism
1,lots boring dialogues cannot skip frustrating start random world quest dialogue npc character able skip dialogue currently honkai sr keeps involved story use slang perfectly adapt game region case brazil
1,fresh player genshin impact mobile dedicated game investing time effort boost account star character completing pull banner disappointed find still obtained star character understand luck plays role experience left feeling overlooked d eartened progressing game without character become daunting task especially monsters levels increase
1,i going talk artifact first rigged second farming good set months yet one resin powers everything game yet little either raise cap decrease regen time rates artifact less rigged add mechanic change stats using farmable materials like honkai star rail change domains piece set farming two sets one bad
1,i love game like lol know probably heard complaints skirks design basic lame like suggestive design design draw left hand maybe horrendous anticipation give piece fabric clothes thought joke saw first time trying turn genshin honkai problem sexy problem looks random nothing special
1,been playing two years medium chromebook updated android nine performance took huge hit black boxes appeared around foliage completely unplayable literally played updating still left contacted support suddenly telling device must low spec game got zero updates upgraded android version review keeps disappearing reason
1,edited play like two days next update already massive amount storage end cannot play ended delete back downloading amount resources sad cannot use genshin cloud mine connected facebook facebook option
1,the app option delete finish quest reinstalled open game way choose voice language unless access game already impossible game still big tablet matter many files deleted game better try games
1,my rating used five stars returning game log account server progress lost tried search solution got help support team fix gave pc requires third party app access lost files compatible mobile gonna delete problem suggest tech support app joke give zero stars
1,this game needs put publicly mobile version takes almost gigabyte right bat may delete lot initial install dollar spend gigabyte phone install gigabyte phone gigabyte un ueed space still cannot download mobile game since tf game mobile take gigabyte fix initial download size maybe player base play console like that
1,add controller gamepad support android ios bad experience many updates addinga good experience feature wasted gigabyte low quality content uninstalling add gamepad support think overit again
1,very good game lore aspect good graphic aesthetics great open world way resin unless paid without resin archon quest considered content back dailies log know many days resin took character good status level expecting good change disappointment want good experience play star rail changed one star terrible cs team
1,some quests impossible complete simply difficult like raiden training quest impossible skip quest button way continue main archon quest takes much skill timing incapable cannot play anymore way forward quest nothing quit game
1,now days game getting worse story getting bigger story conversation taking time playing puzzle game getting lesser ther much interest days time getting wested listing story open world enemies need tough play take long time defeat instead numbers damage
1,great graphic fun game play windows playstation ios controller support still controller support android version last class citizen edit already providing feedback controller support years update still controller support
1,it great deleted progress account happend lot people account blah blah progress got back zero please fix hoyoverse people spend blood sweat tears game three account either reseted cannot access despite making sure rigth password
1,it good game overall made new phone newer type phone able resource packs play game uninstalled eight apps still good enough giant games including email
1,fun first first game burn game much open world game reward benefitting hard work put game challenge give two primo slow long seelie chase give two primo primo per gifting good everything contest earn game money winners b millions players character design so everything rng
1,am frustrated artifact system game one hundred domain def artifact joke feel like killing self hope guys fix like overall game artifact system game gets solid ot artifact probably gets solid mention spiral abyss hard free playplayer like please remove timer option abyss unfair pay win players kill one hundred lev boss one short
1,the smart way sapping money children locking suitable character progress game behind either paywall leaving chance game game near impossible earn good amount tokens chance getting character ridiculous people want spend real money order favorite character gone game later requires havea five star character progess
1,no controller support android game amazing story quests character great android gladly change five stars controllers recognized game android without using third party apps
1,what wrong game thought closed app know game downloading recourses backgorund used gigabyte mobile data battery opened phone game sends notifications silently notice think ask downloading recourses background hope ignore this
1,my genshin lag though much storage updated software phone two times seahorse boss entrance made genshin freeze whole phone crash tries worse loading elements screen crashed hoyoverse please help me
1,i playing since launch hardly improved anything wait three years quick gadget change option wow skip button still existing game since launch basic thing think three year improvement plan goes show mentality important cannot play minute daily nothing least people play long time shame game much better goodbye genshin impact
1,why listen solve problem one star keybinding option game support gamepad game good support gamepad want use gamepads show gamepad option please fix add gamepads support please
1,to devs made great game great story amazing audio phenomenal character corporates understand business stingy rewards tiring aspects like rng artificact farming
1,this new update annoying game keeps crashing everytime new archon quest keep repeat story again sucks game keeps reconnecting know server asia come let finish archon quest bruh
1,i playing game year recently game keeps crashing minute game looked issue many players experiencing problem please fix problem
1,i played game although perfect enjoyed game spent money however main character traveler favorite character game treated poorly especially release fontaine hydro element got last straw functions fix spending dime
1,i love able give review able register much less play enter email pick password info gone come back getting code email seconds left enough time reenter info sure enjoy game right alley frustrated playing good sign come
1,this game fun open world music amazing however artifact system much rng rarely add quality life changes experience better edit chance giving five star
1,if play constantly contacting customer service fix ping enjoying ms ping daily new update nearing release date segregate account ping become worst climb ms ping yellow permanently remain unless contact customer service rerouted fixed issue three years devs incompetent improve server
1,amazing open world design complex combat system although game filled much rng currently game predatory monetization combined stingy developer team
1,when play cannot play unless uninstall reinstall game always getting error unsuffient storage still lot storage left though taking eight hour download game brcause gigabyte
1,hoyoverse try reduce size games decided making clound stream witch much queue optimized devs care new content end game player everyday login game feel boring still already gigabyte size sense first anniversary until rewards still much useless reward still going afraid genshin dead game soon possible
1,unable download content reason game mobile devile need much storage space game saying needs mg gigabyte unreal apps development years never used gigabyte pc application
1,when game fully loads loading screen elements geo symbol fully liads game freeze geo symbol loads backwards game crashes tried installing re installing app buf still work phone enough storage really understand crashes like please fix it
1,seems great controller support confused option changing control type actually implemented android bit rude done developers gambling implementation country huge problem gambling gacha heavily sanctioned convenient gambling ever helping please predate humanity guys quite rude
1,really bad experience play game account almost lost try log pc account cannot create email log using facebook twitch cannot wrong company cannot imagine people spending much account hack far play phone really bad experience especially play abys
1,exploring underwater bad unnecessary censorship disturbing focal point annoys hell combat puzzle stop bringing chinas censorship global annoying tower fantasy kind annoying feature
1,this game designed money compared honkai star rail gacha game china japan e gigabyte blue archive arknights colorful stage azure lane list goes on genshin lacking lot quality life features honkai unlikely manage complete teyvat roadmap smoothly
1,do bother playing looking action packed adventure game literally freaking visual novel combat sprinkled end game purpose build character running around picking mint game
1,bad security tried account told account exist instead email changed lodged report yet told cannot resolve issue talking grinded account top say cannot solve it
1,please new try game enough currency catch game banners every time release event super long rewarding super short hardly rewards
1,i love game absolutely eats storage deleted photos videos plus apps still cannot install full game happens every single update cannot download update physically cannot play game spent money game countless hour cannot play supportive fan game absolutely unbelievable know back anyone knows please help
1,the game lag lowest graphic controls little bit clunky game good expect amazing experience
1,it got sucks update starting problem occurred server frequent reconnections ping internet connection good trying using three different isps using vpn still problem wireless connection smartphone using cable connection pc
1,honest review adventure rank player genshin worth money ever think spending much money artifact drop insanely annoying stuck grinding one artifact need roll def hp absolute bullsh rewards almost nothing love adding new bosses never increase much rasins game favorite child used love game maybe games moreworthit
1,this game incredible every way story gameplay design etc massive problem greedy stingy development ability free play players game currency slow takes multiple months five star character mentioning losing the anniversary rewards suck finally five star want spend multiple weeks getting good artifact rngs literally meant give bad stats like def hp
1,even account creation process close impossible complete hire better user interface designers idea wide screen keyboard horrible registration process say least uninstalled
1,i playing adventure rank three years tired game stingy game prizes spends lot money end game monotonous mention spend money keep losing suggestion give gifts stingy turn honkai game give lot gifts feel like going quit tired game touch game thank three years genshin anniversary gift last year
1,i hate wishing thing hard character hate hard primo heard going adding triple banners stead double double already hard enough happy playing game three years
1,takes hour install play cos time consuming try load running brand new phone great internet speeds
1,why genshin hates players much playing game since many problem complain got fixed nothing coplmpare like everything ever wanted honkai star rail mean problem got fixed defferent game really duspointing carefree games implant ferure game cannot play game like enjoy gi like honkai star rail
1,before release trilled elemental reactions mechanic unfortunately game focused talking simulator endless unskippable dialogues wrong world mysteries intriguing spent hour minute one hangout quest literally chatting character like developers heed player feedback improvement short playtime cannot one requesting skip button since season right
1,when first started half gameplay straight talking rest finding quest early game prevents beginners game able play all
1,for getting character play getting character want chance game making pay says yeah bruh game free playand need pay game why character luck mean pay pay pay game stingy short time cannot progress without spendin really hate system
1,ever since fontaine dropped game kept lag crashing constantly never mondsadt lag reading reviews found happening nearly everyone game problem phone problem
1,switching account requires lot data redownload deleted files cancelled switching obligue download huge files
1,honestly love game absolutely disappointed leave bad review however previously really hardcore player much spent money game really irritating since access pc longer play though compatible android everytime install play five minute crashes relaunch game crashes within seconds clicking menu
