score,content
4,dynamic gameplay awesome graphic complex lore content comes comfortable pace great variety limited time event bit everything everybody main issue lack receptivity part game towards player feedback people complaining resin asking buffs character fallen etc changes forthcoming keep playing recommend cannot say worth sure many games choose
4,i love game think enjoyable interesting storylines aditionally game require one pay unlock many features perfect players play free however experiencing problem time complete peak vindagnyr complete barrier rewards removed character die cold challenge failed notice
4,the anniversary rewards lackluster performance phone harsh heats device fast said game played device handle fantastic character charismatic easily loveable progression story difficulty well balanced always something end game highly recommend someone enjoys open world rpgs occasional multiplayer beautiful game overall
4,i play mobile pc really recommend mobile hard play gets lag phone overheat android user becomes worse cause cause phone black automatically leave game plus takes much storage everything update positive side great game honestly recommend people addicting great storyline graphic amazing character
4,one favourite games play day day great graphic amazing character design quality kit etc take thing slowly probably never burned take thing slowly complete quests event quickly game becomes really stale use resin dailies long grind game great
4,the game great bit grindy rates character summoning low still fun character good depending play issues compatibility mobile terrain thing taking whole minute render properly annoying time challenges game first anniversary completely underwhelming great game still much fun play though recommend it
4,absolutely fantastic beautiful game amazing voice acting fun character fun different lands explore cannot bring bring back five star yet due travesty anniversary event shut ten pull wing glider solve underlying issue communicating ignoring players love game want see succeed still fun game though hate stop playing issue
4,the game visually stunning defiantly something recommended friends acquaintances love open world aspect character design story new inazuma update lacking story telling build monstadt liyue given making difficult feel way towards character someone higher levels find difficult keep motivation trudge dungeons artifact basically useless pieces
4,the main story maintained objectives clear choices sometimes matter sometimes graphic good enjoyable design character well made easy remember map pretty big open world mobile game maybe thing work devs add quests mobs divertissement thing discover
4,i love game general game well developed fun yet challenging anniversary rewards great love see next regions new character one thing though texting thing mobile glitch sometimes send message still text box spamming send button like send message big deal slight annoyance
4,the game pure eye candy joy play newcomers veteran players however slim pickings meaningful amount late game content really left daily commissions bi monthly abyss resets major lack usability settings platforms unlimited fps option granular resolution options well gamepad support android addressing issues better communication go long way game
4,i honestly love game much first time ever spent much time effort single game everything character design backstory visual music gameplay story plot amazing rewards game gives really feel worth effort put example high adventure rank level rewards anniversary rewards well still game super fun ten ten recommend anyone play it
4,genshin good game especially free play graphic good storyline interesting able explore world fighting opponents cooperative friends complete quests missions highly recommend game require large data storage played ohone audio cut scene may tend glitch
4,the game self great graphic great character design great storyline amazing though lot lot exploring waiting certain thing commission event new quest resin etc rewards exploring quest event going downhill still love game ways rewards personal recommendation current parts teyvat bigger like x two x ten add loot
4,generally excellent game comes problems resources really scarce completing event hard level character want always choose carefully invest additionally late game kinda boring apart event basically spiral abyss thirty minute gameplay every two weeks ed thing rewards getting strong high adventure rank
4,the game actually really good let sudden increase bad reviews fool obviously start got thing later done everything much think pretty normal games honest played plenty amount effort mhy put free game graphic gameplay voice acting music phenomenal casual player knows save primo character want find anything wrong rewards
4,the game beautiful design art story interesting look forward tales unfold teyvat however problems despite designed phone started slowly slowly stuck forced uninstall game move pc character interesting start recently feel like remake old neglected character changes sometimes none
4,i really enjoy game hard believe amount content console version mobile controller support android version game easy fighting tough enemies screen controls soundtrack graphic story character great overall experience
4,my gripe missing controller support android beautiful game tons well cooperative engaging battle system story voice acting good frustrating move dodge exactly way like controller support comes unfortunately feature limited ios moment thing keeping prefect score regret downloading game
4,it blast play pc becomes whole story mobile lowest settings new gen phone barely handle game lowest settings frame drops constant affects gameplay point unplayable otherwise content game far great hope mobile build becomes optimized
4,this really fun game download phone work pc issue mobile large hands gets uncomfortable added option controller support mobile really helpful large hands cramped playing long periods time give five outta five added option hook controller combat lot easier too
4,i changed rating five stars four stars still love game controls mobile pretty wonky ping issue times suddenly stop movingrun fighting jump finger close jump button dash time though timed dash difference controls mobile pc huge hope least change layout settings buttons
4,phenomenal game graphic top notch gameplay interesting enough keep hooked long time action packed fights fun require tactics skill point complain mobile player fact game closes accidentally click another app second game takes load gets annoying restart everytime call accidentally click notification
4,this game amazing issues game play lag ridiculously bad barely move around without freezing animated scenes dragon scene render well shows blue everywhere love see fix love play pc version personal favorite fun play mobile
4,this game overall amazing graphic great character design stunning one problem game overheat phone ipad depending playing game tends crash every hour graphic good quality though exceeded expectations free game
4,fantastic game beautiful graphic amazing gameplay far one longest best games ever played however still issues infamous resin problem artifact system quite bad imagine grinding domain hour defence hp type artifact disappointing everything good
4,the game fun provides lot content first start overwhelming amount content road around adventure rank forty five gone plus around adventure rank forty five constantly grind materials limiting factor resin little replen wish slowly however game still enjoyable abyss fun challenge fights fun graphic great overall good game
4,this game adventurous fun exciting eventful defeat bosses meet new companions buddies explore forests mountains lakes much although mobile enough space delete games really like end still enough space frustrating annoying please game smaller lower detail take much storage space
4,its really addicting character quite unique one thing bothers lag sure device using fights seem lag like crazy switching character take seconds sometimes change all
4,everything seems good still issues using bow mobile sometimes sensitivity aiming seems example try aim something moving screen around adjust aim enemy feels heavy sometimes feels like buggy lag cannot aim properly ping usually green sometimes yellow know new features added settings bows help aiming still help problem
4,love open world map character attack moves missions interesting like every game missions gets bit repetitive complaint otherwise beautiful game gotcha system heroes lucky qiqi first week playing one hundred attempts gave trying another one level mind spending money odds low new character added time odds seem worse
4,the game absolutely amazing great graphic interesting storyline amazing character awesome gameplay although eats much storage unless enough space device consider willing free eight gigabyte plus download time game horrible pros cons love game kinda forced brain putting much effort setting honest still amazing worthwhile me
4,i system pet dogs cats games pretty fun experienced multiple bugs teleport way point glitch map die instantly fall damage try teleport somewhere else fall map die last couple times use ten wish thing bugged took wish crashed give anything bummer
4,may well update review give five stars best mobile game ever played pay win open world adventure compelling plot reason four stars bugs really look forward team working crashes stuttering cut scenes though stuttering may phones fault powerful enough one boss kept charging bounds resetting encounter back full hp
4,it lot fun microtransactions feel aggregious necessary play issue run slowing cutscenes able watch single cutscenes without video lag ages audio stays still sputtering bit video completely stopped time playing new pixel five hardware issue lot fun
4,great game love visual story game work mastermind one issue server connectivity network speeds slow strong connectivity area issues story hangs frame freeze narrating story hope rid error future updates please help possible found missions really interesting story endearing hope liter version provided future
4,lovely game story graphic combat system great negatives gacha system ignore focus story instead collecting upgrading character immense size game might uninstall big crazy thing game super slow computer option either turn graphic way playable phone still crashes sometimes
4,the game great bosses loot exploration quests issue game goingi hear everything press buttons scene transaction loading screen way cannot see anything restart takes restart fix bug perfect especially new app really great recommend it
4,genshin impact visually stunning breathtaking person much gamer made want improve playing skills story interesting character impressive every update phones lag gets worse set graphic lowest setting turned developer mode phones setting reinstalled game got worse really hope gets fixed love game see playing longer time
4,the game overall fun love set think fun challenging addicting game one main problem security factors think much safer game two step authentication system lost account multiple times over play mobile mainly play playstation let players bring account different devices restart game play playstation good
4,it great storylines great graphic well done character well designed problem currently fact graphic set lowest setting still lags frustration set highest still lags rate maybe less hopefully able game compatible mobile one last thing please give rewards really hard quest really annoying higher ranks
4,genshin impact extremely addicting entertaining always something new quest receive however sometimes game becomes extremely lag frustrating honest though really concern wonderful game lot wonderful storyboards become pay win near end though annoying part big starting nothing recommended enjoy games toram online botw
4,i love one best open world games mobile one problem audio glitch android really bad music fine time tiniest bit lag impossible avoid samsung audio cut come back every second videos straight work freeze messed audio continues lucky unfreeze later video seconds really ruins experience sometimes
4,straight forward amazin never played large game mobile four gigabyte ramthis provide stability phones usedeventhough works somewhat example dragon cannot seen play glitch crashes five minute love character development environment gameplay add options custom gamepads game legit love hoping improvements next update
4,the game great world huge many different character modifications team modifications never bored game still always rolling special features new character negative point game fact voice chat playing cooperative mode typing playing really uncomfortable difficult next update needs vehicles
4,fun story interesting game play controls bit awkward especially trying change view move fighting enemy difficult precise movements trying pick stuff running takes practice sure touchscreen controls impressed tell game developed console gaming adapted phones slight frustration controls worth getting play though
4,its good graphic story character amazing sad available macbook pro takes much space put graphic lowest order run smoothly ipad fry story animated really lag freeze much problem think internet everything perfection
4,meticulously crafted lovingly created cast unique character roll gacha controls little harder mobile opposed pc play account dexterity everything easy pick learn open world gorgeous love climbing mountains staring scenery almost half year end game repetitive much still appreciate wonderful scenery amazing music
4,ngl game amazing graphic story awesome played game came back audio weird odd static robot sound voice distant headphones plugged partially delete months ago recently reinstalled beginning tutorial motion quite chopy soon went away yet come back continuing play sound slowly gets better full cutscenes sound fine
4,i played game long problem audio fuzy choppy kinda like plugged speakers headphones halfway have audio problems apps games sure something end game graphic look great game runs smoothly
4,it really nice game play give five stars crashes bugs happen time time everything else fine happened start game screen freeze part dragon bugged cannot see properly every intro crashes freeze screen audio becomes choppy working well subtitles hope fix this
4,i love game obsessed weeks character super cute completely invested story current lantern rite event love always something story archon quests gave four stars bugs currently cannot log updating phones software stuck loading screen update tried uninstalling reinstalling still cannot log in
4,the game one best games played free pet peeve start quest without thinking sudden stuck quest unable cooperative like feature call quests mainly certain world quests start another time
4,game good please use jump button anything add like jump attacking mid air reach weakpoints enemy using melee character add one hundred twenty fps support improve smoothness game mid range devices player high end devices like improve loading speed like teleport takes much time load short concern jump button smoothness loading speed love game ï¸
4,it pretty good experience character music world self game good far pay win paywall seen bugs annoying like animals suddenly levitating killed character suddenly start flashing back forth changing character changing character might phone annoying since completely frozen good four five seconds complaining small bug keep getting killed hapn
4,the game honestly great graphic amazing experience awesome one problem stormterror quest know cannot past last light actuator thing time two finish last fight obviously try thing disappeared know timed happened every time step plate disappears great game
4,beautiful open world game love scenery exploring climbing gliding air fighting monsters leveling nice game gives great taste enjoy character unique abilitys weapons variety free good however lot need purchased teams income understandable yet fully explore vast range land looking forward free game worth download time
4,phenomenal game better customise traveller bit furthermore awesome surprising really game free ads popping lot quests choose easy hang bored easily sith different types character free movement game give explore world
4,whoa great game manage download nearly six gigabyte engrossing story great graphic nice quests music calming really appreciate game takes know uses data high speed connection still game shows bandwidth slow apps load without pause know how works yeah con
4,it amazing love game graphic controls nice yet maybe month half ran issue play phone play around five minute maybe less starts lag stutter ping suddenly skyrocketing stuff like tested phone games similar ran perfectly fine besides still good game recommend
4,this game great play mobile issue enough room attack controls and using empty space rotate camera many times hot damn attack button trying turn god damn camera oh guess camera angles lot time think pinned close character causes bunch bad angles especially battles bloody brilliant recommend anyone likes rpgs
4,the cutscenes lag like tomorrow occasionally game crashes overall greatly enjoy biggest complaints mobile users like catching critters pain aimed mode buggy heck overall inefficient use archons save timed archery challenge stated fun game dynamic character interesting plot lines cannot wait next story installment
4,amazing game amazing storyline really like added character play story elements choose reason give four star pc problem amount times game open continue download way much sometimes crashed continue
4,this game truly stunning loved playing every second pc ios upon getting new phone runs fine game poorly optimized reason android crashes needs eight gigabyte ram mobile game clue seriously want to play pc every single time play smoothly kindly tweak thing less optimal may able enjoy game thank you
4,this game absolutely one best games ever played phone open word amazing character design graphic amazing gets hooked hour end two problems experiencing far game mechanic starts glitching sometimes usally happens couple enemies running attacking along another one sometimes game freeze second two middle combat
4,this fun game start great story line beginner friendly though problems reach certain level story quest boring reach higher level daily quest gets pretty hard freeplay player like event hard annoying really like games gets boring loop everyday repeating everything
4,i love game story smooth character easy adore one little complaint deleted many apps able install one still ten gigabyte free storage phone still storyline starts gets stuck hear plot see please fix think devices problem new works perfectly love creators game though amazing
4,i loving game graphic gameplay storyline pretty great buti problems comes cut scenes glitch graphic though phone signal know sort clunky aim archers like sometimes cannot move aim target moves slow little problem phone either way bug hope fixed keep good work
4,a game never disappointed although huge open world map high quality graphic great character design people may like due huge space consumption frame drop lags low end devices like mine device overheat time time worth downloading recommend giving option settings remove special effect animations improve performance like switching character etc
4,the game great thing want point lowest resolutions like medium lower resolution please using marksmen cannot aim buttons close four camera angles fight annoying always focuses grass blocking fight
4,the thing find unpleasant abou game much takes storage plus constant updates difficult adjust great game great graphic great gameplay easy understand well start learn basics fine chance delete game see going back it
4,this game good graphic storyline everything one problem always bothers everytime face dvalinstormterror visual bugs screen show thought fixed redownloading game tried visual bug still remains cannot finish quest confronting dvalin please help devs fix visual bug
4,almost everything game great way world open yet pretty clear need go progress cute character design plus really pretty graphic issue cutscenes janky way whether freezing one frame static y audio really pleasant sucks story interesting
4,i really love game cannot log update using facebook account fix it
4,to honest played game hate mobile controls pc powerful enough still want play game wanting ask mobile controller support edit played game think game fantastic graphic great smooth runs great sometimes issues controls aside think well worth amount storage takes up
4,four stars cause lot bugs glitch commissions slow game hope fix annoying wait stand seconds everytime need pick something moreover graphic great one thing checking updates thing forever soemtimes game start restart game please fix thanks reading giving time user reviews
4,the gameplay story truly amazing problems game big problems looked fixed game downloads moment first problem controls bit close often find hitting slash button climbing simply moving screen around last problem game optimised bit low end devices run smoothly epic
4,good game version ruined gameplay unlike previous version still running smoothly cannot play decently screen keeps freezing like watching powerpoint presentation please fix edit game running better option update v writing
4,an issue hate camera angles fighting enemy want camera ground one wants moment start hitting enemy moves automatically ruins experience moving much weird low angles prioritize high angles fight recently issues screen freezing freeze device people know well
4,it great game amazing animations every often enough data internet connection plays little phone tablet start glitching bit close app turn device wait turn device back open app works fine
4,great game beautiful graphic honestly one best soundtracks heard mobile game thing annoy lag pixel cannot exit app five seconds crashes close re open frustrating especially want check text wiki page
4,one best games phone gameplay fun aspect element physics pretty fun experiment especially since devs give five character quickly history world able found books great idea since choice problem loot takes long appear tap slowly register undeniably annoying grind instead shopping needed buy
4,fun great game play playing since beginning amazing open world adventure character customizable still love character story major bugs game sent email customer service reply edit new update fixes bugs play missed many quests rewards raised rating four stars
4,i skeptical first fell love game right away mobile player controls camera friendly currently archer character party ever easy die aiming due to adjust camera constantly fine movement controls audio crackling sounds really distorted following latest android samsung software update please fix love overall
4,gameplay fun addictive absolutely obsessed game however complaint game continues freeze sometimes crash major fights game usually freeze three minute gets really frustrating boss levels especially ruin guards ley line openings please feature game automatically pause app freeze
4,it glitch stunning game nonetheless think supplies given chests dropped ore materials equipment think map precise areas places trying find probably show otherwise fun game awesome character
4,i really love game warned game huge lucky space character bad charming ways graphic great recommend turning bit phone beast though problem audio glitch experiencing note nine running fine until update audio often distorted random made sad understand character sometimes
4,the graphic absolutely gorgeous character voice acting adventure storyline music everything amazing reason rated four stars slight audio problems glitching well camera problems camera sometimes moves one direction without touching anything audio cuts briefly regardless highly recommend game play mobile bit lag assuming normal definitely play
4,i like system easy understand many functions story stormbreaker seems boring well still level forty still long way go finish story kind like default controller setting allowed customise button eg move attack button lower abit move jump button upper bit think great
4,september right playing samsung galaxy ten set high performance sure play game although since yesterday thing going well without issue struck first town cutscene lag freezing along audio turning static pops worse part think cutscene loops back replays update september seems working uninstalling reinstalling it
4,it nice game stellar graphic cannot say much yet little lag times thing find super annoying purge everything phone order enough space play hope comes switch soon really like play prevent phone exploding much gigabyte game requires
4,good game takes way long start downloading thing needs takes hour reason stops downloading start due slow way game start able play much played one amazing games combining rpgs gachas nevertheless enjoyed game know problems mentioned happened ok please fix thanks
4,amazing game great graphic easy controls needs work cooperative mode needs work allow players assist daily commissions regular story missions anything common example side quests playing cooperative mode cannot view missions every domain try cannot played multiplayer mode game controller input support control mapping easier many players
